[
  {
    "id": "018f5a00-0000-7000-8000-000000000521",
    "tenant_id": "eko",
    "circle_id": "018f5a00-0000-7000-8000-000000000501",
    "csp_location_id": "018f5a00-0000-7000-8000-000000000105",
    "dc_user_id": "018f5a00-0000-7000-8000-000000000201",
    "assigned_by_user_id": "018f5a00-0000-7000-8000-000000000203",
    "reason": "INITIAL_ALLOCATION",
    "valid_from": "2026-06-01",
    "valid_to": null,
    "updated_at": "2026-06-01T05:00:00Z"
  },
  {
    "id": "018f5a00-0000-7000-8000-000000000522",
    "tenant_id": "eko",
    "circle_id": "018f5a00-0000-7000-8000-000000000501",
    "csp_location_id": "018f5a00-0000-7000-8000-000000000106",
    "dc_user_id": "018f5a00-0000-7000-8000-000000000201",
    "assigned_by_user_id": "018f5a00-0000-7000-8000-000000000203",
    "reason": "INITIAL_ALLOCATION",
    "valid_from": "2026-06-01",
    "valid_to": null,
    "updated_at": "2026-06-01T05:00:00Z"
  },
  {
    "id": "018f5a00-0000-7000-8000-000000000523",
    "tenant_id": "eko",
    "circle_id": "018f5a00-0000-7000-8000-000000000501",
    "csp_location_id": "018f5a00-0000-7000-8000-000000000107",
    "dc_user_id": "018f5a00-0000-7000-8000-000000000201",
    "assigned_by_user_id": "018f5a00-0000-7000-8000-000000000203",
    "reason": "INITIAL_ALLOCATION",
    "valid_from": "2026-06-01",
    "valid_to": null,
    "updated_at": "2026-06-01T05:00:00Z"
  },
  {
    "id": "018f5a00-0000-7000-8000-000000000524",
    "tenant_id": "eko",
    "circle_id": "018f5a00-0000-7000-8000-000000000501",
    "csp_location_id": "018f5a00-0000-7000-8000-000000000108",
    "dc_user_id": "018f5a00-0000-7000-8000-000000000201",
    "assigned_by_user_id": "018f5a00-0000-7000-8000-000000000203",
    "reason": "INITIAL_ALLOCATION",
    "valid_from": "2026-06-01",
    "valid_to": null,
    "updated_at": "2026-06-01T05:00:00Z"
  },
  {
    "id": "018f5a00-0000-7000-8000-000000000525",
    "tenant_id": "eko",
    "circle_id": "018f5a00-0000-7000-8000-000000000501",
    "csp_location_id": "018f5a00-0000-7000-8000-000000000109",
    "dc_user_id": "018f5a00-0000-7000-8000-000000000201",
    "assigned_by_user_id": "018f5a00-0000-7000-8000-000000000203",
    "reason": "INITIAL_ALLOCATION",
    "valid_from": "2026-06-01",
    "valid_to": null,
    "updated_at": "2026-06-01T05:00:00Z"
  }
]